URL,Version,Status,OIDs,Name,Title,Descriptino,Uses,Used,Sources
https://department-of-veterans-affairs.github.io/mhv-fhir-phr-mapping/ValueSet/AllergyCategoryVS,0.3.6,active,,AllergyCategoryVS,Subset of allergy intolerance category,"not all of them",,"hl7.fhir.r4.core"
https://department-of-veterans-affairs.github.io/mhv-fhir-phr-mapping/ValueSet/AllergyObservedHistoricVS,0.3.6,active,,AllergyObservedHistoricVS,Allergy Observed vs Historic ValueSet,"The codes for Allergy Observed vs Historic",,"Internal"
https://department-of-veterans-affairs.github.io/mhv-fhir-phr-mapping/ValueSet/ConditionClinicalStatusVS,0.3.6,active,,ConditionClinicalStatusVS,Subset of condition clinical status,"Not all of them",,"THO"
https://department-of-veterans-affairs.github.io/mhv-fhir-phr-mapping/ValueSet/ConditionVerificationVS,0.3.6,active,,ConditionVerificationVS,Subset of condition verification status,"not all of them",,"THO"
https://department-of-veterans-affairs.github.io/mhv-fhir-phr-mapping/ValueSet/DocumentReferenceTypeVS,0.3.6,active,,DocumentReferenceTypeVS,Known DocumentReference types,"DocumentReference types",,"LOINC"
https://department-of-veterans-affairs.github.io/mhv-fhir-phr-mapping/ValueSet/KindLabReportVS,0.3.6,active,,KindLabReportVS,Kind of Lab Report,"Specific kind of Pathology or Microbiology mapped from labReportTO/type",,"THO (V2),SCT"
https://department-of-veterans-affairs.github.io/mhv-fhir-phr-mapping/ValueSet/LabReportVS,0.3.6,active,,LabReportVS,Known Lab Report types,"Lab Report types",,"LOINC"
https://department-of-veterans-affairs.github.io/mhv-fhir-phr-mapping/ValueSet/NoteTypeVS,0.3.6,active,,NoteTypeVS,Known Note types,"Note types",,"LOINC"
